{
  "schema_version": 1,
  "updated_at": "2026-08-04T19:27:46Z",
  "allowed_classifications": ["exact_source_pinned", "native_faithful", "native_approximation_with_justification", "incomplete"],
  "project_status": "incomplete",
  "criteria": [
    {"criterion_id":"ACC-FRONT-OPENING","domain":"frontend","title":"Opening, intro, title, attract, and start animations/timing match accepted original references","classification":"incomplete","status":"pending","task_ids":["R4-FRONTEND-INTRO-TITLE"],"evidence_ids":[],"required_tests":["opening production-flow regression"],"required_proof":["reference/native video","numbered full-resolution frames","contact sheet"],"justification":null,"accepted_by_session_id":null,"accepted_at":null},
    {"criterion_id":"ACC-FRONT-MENUS","domain":"frontend","title":"All menu transitions, input behavior, and UI details are complete","classification":"incomplete","status":"pending","task_ids":["R4-MENUS-UI"],"evidence_ids":[],"required_tests":["menu flow and input suite"],"required_proof":["production-path menu video and frames"],"justification":null,"accepted_by_session_id":null,"accepted_at":null},
    {"criterion_id":"ACC-DATA-PAGES","domain":"season_data","title":"Player/team data pages are fully wired, arrow-aligned, and free of extra zeros/periods","classification":"incomplete","status":"pending","task_ids":["R3-TEAM-MGMT-DATA","R4-MENUS-UI"],"evidence_ids":[],"required_tests":["team/player data suite"],"required_proof":["page-by-page original/native frames"],"justification":null,"accepted_by_session_id":null,"accepted_at":null},
    {"criterion_id":"ACC-PRESEASON","domain":"season_data","title":"Preseason selection, launch, completed game, and return flow are complete","classification":"incomplete","status":"pending","task_ids":["R3-SEASON-PROGRESSION-SAVE","R4-MENUS-UI"],"evidence_ids":[],"required_tests":["preseason end-to-end"],"required_proof":["full production-path run"],"justification":null,"accepted_by_session_id":null,"accepted_at":null},
    {"criterion_id":"ACC-SEASON-PROGRESSION","domain":"season_data","title":"Season schedule, progression, completed games, and completed-season flow are complete","classification":"incomplete","status":"pending","task_ids":["R3-SEASON-PROGRESSION-SAVE"],"evidence_ids":[],"required_tests":["deterministic full-season simulation","completed game commit tests"],"required_proof":["season checkpoints and final state"],"justification":null,"accepted_by_session_id":null,"accepted_at":null},
    {"criterion_id":"ACC-STANDINGS-SAVE","domain":"season_data","title":"Standings and save/load preserve validated season state","classification":"incomplete","status":"pending","task_ids":["R3-SEASON-PROGRESSION-SAVE"],"evidence_ids":[],"required_tests":["standings","save/load round trip","malformed save failure"],"required_proof":["before/after save and standings frames"],"justification":null,"accepted_by_session_id":null,"accepted_at":null},
    {"criterion_id":"ACC-MANAGEMENT","domain":"season_data","title":"Team management, starters, playbook, substitutions, and roster wiring are complete","classification":"incomplete","status":"pending","task_ids":["R1-LIVE-FOUNDATION","R3-TEAM-MGMT-DATA"],"evidence_ids":[],"required_tests":["team management suite","lineup integration"],"required_proof":["editor and live-lineup proof"],"justification":null,"accepted_by_session_id":null,"accepted_at":null},
    {"criterion_id":"ACC-ALLSTAR","domain":"season_data","title":"All-Star functionality is complete and launches/returns correctly","classification":"incomplete","status":"pending","task_ids":["R3-ALLSTAR"],"evidence_ids":[],"required_tests":["All-Star end-to-end"],"required_proof":["selection/game/return video"],"justification":null,"accepted_by_session_id":null,"accepted_at":null},
    {"criterion_id":"ACC-LEADERS","domain":"season_data","title":"League Leaders uses real ranked per-player statistical data","classification":"incomplete","status":"pending","task_ids":["R3-PLAYER-STATS-LEADERS"],"evidence_ids":["EVID-R3-PLAYER-STATS-TERMINAL"],"required_tests":["ranking and tie-break tests","category navigation"],"required_proof":["populated leader screens compared to reference"],"justification":"Good-signed terminal 35d31f5 delivers native-faithful populated FIELD GOALS, TOTAL POINTS, 3 POINT SHOTS and FREE THROWS categories from validated FGA/FGM, 3PA/3PM and FTA/FTM data. The high-level criterion remains incomplete/pending because STEALS, BLOCKED SHOTS and REBOUNDS remain unavailable; no full-criterion acceptance is inferred from the pushed slice.","accepted_by_session_id":null,"accepted_at":null},
    {"criterion_id":"ACC-PLAYER-STATS","domain":"season_data","title":"Per-player game/season statistics feed data pages, saves, and leader screens","classification":"incomplete","status":"pending","task_ids":["R3-PLAYER-STATS-LEADERS","R3-SEASON-PROGRESSION-SAVE"],"evidence_ids":["EVID-R3-PLAYER-STATS-TERMINAL"],"required_tests":["stat accumulation","persistence","leader integration"],"required_proof":["game result through leader-page proof"],"justification":"Good-signed terminal 35d31f5 proves bounded accumulation, persistence and populated leader integration for FGA/FGM, 3PA/3PM and FTA/FTM. The criterion remains incomplete/pending because steals/blocks/rebounds, incomplete migrated seasons, original SRAM import and the separately scoped full progression/save flow remain unavailable or unfinished.","accepted_by_session_id":null,"accepted_at":null},
    {"criterion_id":"ACC-CPU-POLICY","domain":"gameplay_behavior","title":"CPU play selection, formation, movement, spacing, links, matchups, switching, decisions, and shot timing are complete","classification":"incomplete","status":"pending","task_ids":["R0A-ADOPT-CPU-TIP","R1-CPU-PLAY-LIFECYCLE","R1-LIVE-FOUNDATION"],"evidence_ids":["EVID-ADOPT-CPU-KERNEL"],"required_tests":["deterministic CPU scenarios","difficulty coverage"],"required_proof":["original/native gameplay sequences"],"justification":null,"accepted_by_session_id":null,"accepted_at":null},
    {"criterion_id":"ACC-MOTION-ANIMATION","domain":"gameplay_presentation","title":"Directional poses, dribble, pass, jump, shot, defense, contact, foul, free-throw, rebound, block, and steal animations are complete","classification":"incomplete","status":"pending","task_ids":["R0A-ADOPT-TIP-VIS","R0A-ADOPT-AWAY-FACING","R2-GAMEPLAY-PRESENTATION"],"evidence_ids":["EVID-ADOPT-TIP-VIS-PROOF","EVID-ADOPT-AWAY-PROOF"],"required_tests":["animation state/timing suite"],"required_proof":["action videos","numbered frames","reference comparison"],"justification":null,"accepted_by_session_id":null,"accepted_at":null},
    {"criterion_id":"ACC-SHOTS","domain":"gameplay_behavior","title":"Shot selection, launch, resolution, supported outcomes, layups, dunks, and jump shots are complete","classification":"incomplete","status":"pending","task_ids":["R2-SHOTS-OUTCOMES"],"evidence_ids":[],"required_tests":["shot matrix","score/possession outcomes"],"required_proof":["each supported shot/outcome production proof"],"justification":null,"accepted_by_session_id":null,"accepted_at":null},
    {"criterion_id":"ACC-TIPOFF","domain":"gameplay_behavior","title":"Tip-off input, visible jump, presentation, claim, tie, and live handoff are complete","classification":"incomplete","status":"pending","task_ids":["R0A-ADOPT-CPU-TIP","R0A-ADOPT-TIP-VIS","R1-TIP-FIDELITY"],"evidence_ids":["EVID-ADOPT-TIP-INPUT","EVID-ADOPT-TIP-VIS-PROOF","EVID-R1-TIP-SOURCE-MECHANICS","EVID-R1-TIP-TERMINAL-PROOF"],"required_tests":["tip input/winner/handoff matrix"],"required_proof":["full contest frames and video"],"justification":"R1 TIP terminal native implementation and deterministic proof are Sol/independent accepted at e21f9a6 with P0/P1/P2 zero. The overall criterion remains incomplete because original single-winner tie settlement, selector/receiver ownership, TTDT player mapping, complete original trajectory/close-up, and current-main integration are not yet accepted.","accepted_by_session_id":null,"accepted_at":null},
    {"criterion_id":"ACC-CLOCK-PERIODS","domain":"gameplay_behavior","title":"Game clock, shot clock, periods, halftime, overtime, scoring, and final-game flow are complete","classification":"incomplete","status":"pending","task_ids":["R2-CLOCK-LINEUPS-FATIGUE","R3-SEASON-PROGRESSION-SAVE"],"evidence_ids":[],"required_tests":["clock/period/overtime matrix"],"required_proof":["halftime, overtime, and final flow proof"],"justification":null,"accepted_by_session_id":null,"accepted_at":null},
    {"criterion_id":"ACC-RULES-POSSESSION","domain":"gameplay_behavior","title":"Possession, violations, contact, fouls, referee, restarts, and free throws are complete","classification":"incomplete","status":"pending","task_ids":["R2-DEFENSE-CONTACT","R2-RULES-RESTARTS"],"evidence_ids":[],"required_tests":["rules event matrix","restart invariants"],"required_proof":["violation/foul/referee/free-throw sequences"],"justification":null,"accepted_by_session_id":null,"accepted_at":null},
    {"criterion_id":"ACC-LINEUPS-FATIGUE","domain":"gameplay_behavior","title":"Substitutions, active lineups, matchup ownership, and fatigue affect live play correctly","classification":"incomplete","status":"pending","task_ids":["R1-LIVE-FOUNDATION","R2-CLOCK-LINEUPS-FATIGUE","R3-TEAM-MGMT-DATA"],"evidence_ids":[],"required_tests":["lineup/fatigue/substitution integration"],"required_proof":["roster edit through live game proof"],"justification":null,"accepted_by_session_id":null,"accepted_at":null},